table_name,harvest_family,rows,hunt_code_rows,total_harvest_sum,unique_hunt_codes
fall_management_by_region_area_2023,Turkey Fall Management,17,0,1764.0,0
fall_management_statewide_history_2014_2023,Turkey Fall Management Statewide History,10,0,13222.0,0
general_season_statewide_history_2010_2024,Turkey General Season Statewide History,15,0,27795.0,0
spring_general_season_by_region_county_2024,Turkey Spring General Season,36,0,6295.0,0
spring_limited_entry_cwmu_by_hunt_2024,Turkey Spring Limited Entry/CWMU,7,7,635.0,7
spring_limited_entry_cwmu_statewide_history_1991_2024,Turkey Spring Limited Entry/CWMU Statewide History,34,0,29430.0,0
spring_youth_general_season_by_region_county_2024,Turkey Spring Youth General Season,36,0,1444.0,0
